{
  "profile_id": "xianxia-goddess",
  "language": "zh",
  "title": "玄幻神女角色设定板",
  "subtitle": "主立绘 / 三视图 / 神性脸部 / 仙衣材质 / 法器纹样",
  "canvas": { "width": 1440, "height": 2560, "background": "#101719" },
  "theme": { "panel_fill": "#172224", "panel_border": "#536966", "accent": "#d6e7cf", "text": "#f3f8ee", "muted": "#aebdb4", "chip_fill": "#223532", "placeholder_fill": "#1d2d2d" },
  "character": {
    "name": "玄幻神女",
    "archetype": "仙侠神女",
    "visual_theme": "唯美玄幻、国风神话、仙气、游戏角色设定板",
    "identity_lock": "长发飘逸，神性温柔眼神，清透面容，修长比例，古典仙侠气质",
    "costume_lock": "浅色仙衣，半透明披帛，玉石首饰，金青色刺绣，长裙拖尾",
    "materials": ["月白薄纱", "青玉", "淡金刺绣", "透明披帛", "柔光粒子"],
    "props": ["玉石法器", "神纹圆环", "莲花光印", "发簪"],
    "palette": ["月白", "青玉绿", "淡金", "雾蓝", "柔光白"],
    "world": "云海仙宫与月光神殿",
    "avoid": ["现代服装", "科幻元素", "随机换发型", "多角色混乱", "图片内乱码小字", "视频时间线"]
  },
  "reference_inputs": { "face_anchors": [], "costume_anchors": [], "prop_anchors": [], "style_anchors": [], "generic_references": [] },
  "sections": [
    { "id": "hero_full_body", "label": "主立绘", "role": "hero", "caption": "完整展示神女气质。", "prompt": "全身主立绘，玄幻神女站在云海仙宫前，月白仙衣，半透明披帛，青玉法器，淡金神纹，唯美国风神话角色设定稿", "image": "" },
    { "id": "turnaround_front", "label": "正面视图", "role": "turnaround", "caption": "锁定正面仙衣轮廓。", "prompt": "正面三视图，同一玄幻神女，月白仙衣、青玉首饰、淡金刺绣结构清楚", "image": "" },
    { "id": "turnaround_side", "label": "侧面视图", "role": "turnaround", "caption": "展示披帛、裙摆和发丝。", "prompt": "侧面三视图，同一角色，长发、透明披帛、长裙拖尾层次清楚", "image": "" },
    { "id": "turnaround_back", "label": "背面视图", "role": "turnaround", "caption": "展示背部和拖尾。", "prompt": "背面三视图，长发背影，月白拖尾裙摆，青玉背饰和发簪", "image": "" },
    { "id": "face_closeup", "label": "脸部特写", "role": "detail", "caption": "锁定神性表情。", "prompt": "脸部特写，神性温柔眼神，清透妆容，长发飘逸，国风仙侠美人", "image": "" },
    { "id": "eye_detail", "label": "眼睛设定", "role": "detail", "caption": "瞳色、神纹和柔光。", "prompt": "眼睛超近景，雾蓝瞳色，淡金神纹高光，温柔神性", "image": "" },
    { "id": "costume_detail", "label": "仙衣材质", "role": "material", "caption": "月白薄纱和青玉。", "prompt": "仙衣材质特写，月白薄纱、透明披帛、青玉饰品、淡金刺绣", "image": "" },
    { "id": "prop_detail", "label": "玉石法器", "role": "prop", "caption": "法器和神纹圆环。", "prompt": "玉石法器设定，青玉质感，淡金神纹圆环，莲花光印，玄幻道具概念图", "image": "" },
    { "id": "footwear_detail", "label": "鞋履裙摆", "role": "detail", "caption": "脚部、鞋和裙摆落点。", "prompt": "脚部鞋履细节，月白绣鞋，透明裙摆，云雾地面，柔光粒子", "image": "" },
    { "id": "palette", "label": "色卡材质", "role": "palette", "caption": "月白、青玉、淡金、雾蓝。", "prompt": "角色色卡与材质样本，月白、青玉绿、淡金、雾蓝、柔光白，国风神话设定板", "image": "" }
  ]
}
